[
{"Id":2,"Name":"风车","Type":1,"ProduceMoney":12,"ProduceGear":0,"ProduceAtomic":0,"ArmyId":0,"FacilityId":0,"ResName":null,"StyleCount":0,"MeritExp":0},
{"Id":3,"Name":"小镇","Type":1,"ProduceMoney":12,"ProduceGear":0,"ProduceAtomic":0,"ArmyId":0,"FacilityId":0,"ResName":null,"StyleCount":0,"MeritExp":0},
{"Id":11,"Name":"小城市","Type":2,"ProduceMoney":0,"ProduceGear":0,"ProduceAtomic":0,"ArmyId":109001,"FacilityId":20001,"ResName":null,"StyleCount":0,"MeritExp":20},
{"Id":12,"Name":"中城市","Type":2,"ProduceMoney":0,"ProduceGear":0,"ProduceAtomic":0,"ArmyId":109002,"FacilityId":20002,"ResName":null,"StyleCount":0,"MeritExp":30},
{"Id":13,"Name":"大城市","Type":2,"ProduceMoney":0,"ProduceGear":0,"ProduceAtomic":0,"ArmyId":109003,"FacilityId":20003,"ResName":null,"StyleCount":0,"MeritExp":40},
{"Id":14,"Name":"大都市","Type":2,"ProduceMoney":0,"ProduceGear":0,"ProduceAtomic":0,"ArmyId":109004,"FacilityId":20004,"ResName":null,"StyleCount":0,"MeritExp":50},
{"Id":15,"Name":"首都1","Type":2,"ProduceMoney":0,"ProduceGear":0,"ProduceAtomic":0,"ArmyId":109005,"FacilityId":20005,"ResName":null,"StyleCount":0,"MeritExp":60},
{"Id":16,"Name":"首都2","Type":2,"ProduceMoney":0,"ProduceGear":0,"ProduceAtomic":0,"ArmyId":109005,"FacilityId":20006,"ResName":null,"StyleCount":0,"MeritExp":60},
{"Id":17,"Name":"首都3","Type":2,"ProduceMoney":0,"ProduceGear":0,"ProduceAtomic":0,"ArmyId":109005,"FacilityId":20007,"ResName":null,"StyleCount":0,"MeritExp":60},
{"Id":18,"Name":"首都4","Type":2,"ProduceMoney":0,"ProduceGear":0,"ProduceAtomic":0,"ArmyId":109005,"FacilityId":20008,"ResName":null,"StyleCount":0,"MeritExp":60},
{"Id":19,"Name":"首都5","Type":2,"ProduceMoney":0,"ProduceGear":0,"ProduceAtomic":0,"ArmyId":109005,"FacilityId":20009,"ResName":null,"StyleCount":0,"MeritExp":60},
{"Id":21,"Name":"炼油厂","Type":3,"ProduceMoney":0,"ProduceGear":6,"ProduceAtomic":0,"ArmyId":0,"FacilityId":0,"ResName":null,"StyleCount":0,"MeritExp":0},
{"Id":22,"Name":"大工厂","Type":3,"ProduceMoney":0,"ProduceGear":12,"ProduceAtomic":0,"ArmyId":0,"FacilityId":0,"ResName":null,"StyleCount":0,"MeritExp":0},
{"Id":23,"Name":"核电站","Type":3,"ProduceMoney":0,"ProduceGear":28,"ProduceAtomic":5,"ArmyId":0,"FacilityId":0,"ResName":null,"StyleCount":0,"MeritExp":0},
{"Id":31,"Name":"军港1","Type":4,"ProduceMoney":10,"ProduceGear":6,"ProduceAtomic":0,"ArmyId":0,"FacilityId":20701,"ResName":null,"StyleCount":0,"MeritExp":20},
{"Id":32,"Name":"军港2","Type":4,"ProduceMoney":10,"ProduceGear":6,"ProduceAtomic":0,"ArmyId":0,"FacilityId":20702,"ResName":null,"StyleCount":0,"MeritExp":20},
{"Id":33,"Name":"军港3","Type":4,"ProduceMoney":10,"ProduceGear":6,"ProduceAtomic":0,"ArmyId":0,"FacilityId":20703,"ResName":null,"StyleCount":0,"MeritExp":20},
{"Id":34,"Name":"军港4","Type":4,"ProduceMoney":10,"ProduceGear":6,"ProduceAtomic":0,"ArmyId":0,"FacilityId":20704,"ResName":null,"StyleCount":0,"MeritExp":20}
]